{
  "culprit_ref": "aaaaaaaaaaaaaaaaaaaaaaaaaaaaaaaaaaaaaaaaaaaaaaaaaaaaaaaaaaaaaaaa",
  "diff_vs_green_ref": "bbbbbbbbbbbbbbbbbbbbbbbbbbbbbbbbbbbbbbbbbbbbbbbbbbbbbbbbbbbbbbbb",
  "suspect_targets": [
    "//src/merge:merge_lib",
    "//src/queue:queue_lib"
  ],
  "bisect_path": [
    "cccccccccccccccccccccccccccccccccccccccccccccccccccccccccccccccc",
    "dddddddddddddddddddddddddddddddddddddddddddddddddddddddddddddddd"
  ],
  "size_bytes": 8192
}
